<?xml version="1.0"?>
<functionDocumentation xmlns:xsi="http://www.w3.org/2001/XMLSchema-instance"
                       xsi:noNamespaceSchemaLocation="funcdoc.xsd"
                       namespace="text">
    <function name="text length">
        <argType>Text</argType>
        <returnType>Number</returnType>
        <description>
            <p>Gets the length of the given text.</p>
            <p>Technical note: this is actually the number of Unicode codepoints in the text.  For English text without accents, one character is one codepoint.  If you have accents or non-English characters in your text, what looks like one character may be made up of multiple codepoints.</p>
        </description>
        <example>
            <input>"hello"</input>
            <output>5</output>
        </example>
        <example>
            <input>"a b."</input>
            <output>4</output>
        </example>
        <example>
            <input>""</input>
            <output>0</output>
        </example>
    </function>
    <function name="replace all">
        <argType>(Text, Text, Text)</argType>
        <returnType>Text</returnType>
        <description>
            <p>Replaces all occurrences of the first text with the second text, within the third text</p>
            <p>If the first text is empty, no replacement is performed.  If any occurrences overlap, the earlier part is replaced first.</p>
        </description>
        <example>
            <input>("at", "og", "The cat in the hat")</input>
            <output>"The cog in the hog"</output>
        </example>
        <example>
            <input>("oo", "a", "Mooo!")</input>
            <output>"Mao!"</output>
        </example>
        <example>
            <input>("", "x", "Orange")</input>
            <output>"Orange"</output>
        </example>
    </function>
</functionDocumentation>